{
   "proc_input_file": "processes.json",
   "dot_input_file": "test.dot",
   "output_path": "./data",
   "num_depsteps": 2,
   "depcode": {
       "codename": "openmc",
       "exec_path": "openmc",
       "template_input_file_path": {
           "geometry": "./geometry.xml",
           "materials": "./materials.xml",
           "settings": "./settings.xml",
           "chain_file": "./test_chain.xml"
       },
       "npop": 50,
       "active_cycles": 20,
       "inactive_cycles": 20,
       "geo_file_paths": ["./new_material.xml"]
   },
   "simulation": {
       "sim_name": "test_simulation_openmc",
       "db_name": "db_saltproc_openmc.h5",
       "restart_flag": false,
       "adjust_geo": false
   },
   "reactor": {
       "volume": 1.0,
       "mass_flowrate": 9.92E+6,
       "power_levels": [ 1.250E+9 ],
       "dep_step_length_cumulative": [ 5 ]
   }
}
