{
   "proc_input_file": "msbr_objects.json",
   "dot_input_file": "msbr.dot",
   "output_path": "./data",
   "num_depsteps": 12,
   "depcode": {
       "codename": "serpent",
       "exec_path": "sss2",
       "template_input_file_path": "./msbr_endfb71.serpent",
       "npop": 50,
       "active_cycles": 20,
       "inactive_cycles": 20,
       "geo_file_paths": ["./geometry/msbr_full.ini"]
   },
   "simulation": {
       "sim_name": "msbr_example_simulation",
       "db_name": "msbr_kl_100_saltproc.h5",
       "restart_flag": false,
       "adjust_geo": false
   },
   "reactor": {
       "volume": 1.0,
       "mass_flowrate": 9920000,
       "power_levels": [ 2250000000 ],
       "dep_step_length_cumulative": [ 3 ]
   }
}
