{
   "proc_input_file": "tap_objects.json",
   "dot_input_file": "tap.dot",
   "output_path": "./data",
   "num_depsteps": 3,
   "depcode": {
       "codename": "serpent",
       "exec_path": "sss2",
       "template_input_file_path": "./tap.serpent",
       "npop": 50,
       "active_cycles": 20,
       "inactive_cycles": 20,
       "geo_file_paths": [
           "./geometry/347_base.ini",
           "./geometry/406.ini",
           "./geometry/427.ini",
           "./geometry/505.ini",
           "./geometry/576.ini",
           "./geometry/633.ini",
           "./geometry/681.ini",
           "./geometry/840.ini",
           "./geometry/880.ini",
           "./geometry/900.ini",
           "./geometry/988.ini",
           "./geometry/1126.ini",
           "./geometry/1338.ini",
           "./geometry/1498.ini",
           "./geometry/1668_all.ini"
       ]
   },
   "simulation": {
       "sim_name": "test_simulation",
       "db_name": "db_saltproc.h5",
       "restart_flag": false,
       "adjust_geo": true
   },
   "reactor": {
       "volume": 1.0,
       "mass_flowrate": 9920000,
       "power_levels": [ 1250000000 ],
       "dep_step_length_cumulative": [ 2 ]
   }
}
