{
   "proc_input_file": "processes.json",
   "dot_input_file": "paths.dot",
   "output_path": ".",
   "num_depsteps": 2,
   "depcode": {
       "codename": "serpent",
       "exec_path": "sss2",
       "template_input_file_path": "test_input.ini",
       "npop": 100,
       "active_cycles": 20,
       "inactive_cycles": 5,
       "geo_file_paths": ["../../serpent_data/test_geo.inp"]
   },
   "simulation": {
       "sim_name": "Integration test",
       "db_name": "_test_db.h5",
       "restart_flag": true,
       "adjust_geo": false
   },
   "reactor": {
       "volume": 1.0,
       "mass_flowrate": 0.0,
       "power_levels": [ 1.250E+9 ],
       "dep_step_length_cumulative": [ 3 ]
   }
}
