{
   "proc_input_file": "test_processes.json",
   "dot_input_file": "test_paths.dot",
   "output_path": ".",
   "num_depsteps": 2,
   "depcode": {
       "codename": "serpent",
       "exec_path": "sss2",
       "template_input_file_path": "./test_input.ini",
       "npop": 50,
       "active_cycles": 20,
       "inactive_cycles": 20,
       "geo_file_paths": ["./test_geometry_base.ini"]
   },
   "simulation": {
       "sim_name": "tap_integration_test",
       "db_name": "test_db.h5",
       "restart_flag": false,
       "adjust_geo": false
   },
   "reactor": {
       "volume": 1.0,
       "mass_flowrate": 9.92E+6,
       "power_levels": [ 1.250E+9 ],
       "dep_step_length_cumulative": [ 5 ]
   }
}
